{
  "$schema": "https://json-schema.org/draft/2020-12/schema",
  "$id": "keymap-v1.schema.json",
  "title": "Keymap Definition v1",
  "description": "キーマップ定義フォーマット v1。逐次入力（ローマ字等）と同時打鍵入力（薙刀式・NICOLA 等）の両方を表現する。",
  "type": "object",
  "required": [
    "formatVersion",
    "name",
    "behavior"
  ],
  "properties": {
    "$schema": {
      "type": "string",
      "description": "JSON Schema へのパス（エディタの補完用）。ランタイムは無視する。"
    },
    "formatVersion": {
      "type": "string",
      "const": "2.0",
      "description": "フォーマットバージョン。v2 は \"2.0\" 固定"
    },
    "requires": {
      "type": "array",
      "items": {
        "type": "string",
        "pattern": "^[a-z][A-Za-z0-9]*(:[A-Za-z0-9]+)?$"
      },
      "uniqueItems": true,
      "description": "この配列が要求するセマンティクスの名前。理解できない名前が 1 つでもあるランタイムは読み込みを拒否する（黙って無視してはならないカテゴリ。extensions / x- とは逆向きの契約）。名前の正典は docs/key-action-registry.json の semantics。"
    },
    "requiresInput": {
      "type": "string",
      "enum": [
        "L1",
        "L2",
        "L3"
      ],
      "description": "この配列の成立に必要な入力イベントの最低段。L1=文字列のみ / L2=keydown 列 / L3=keydown+keyup（押下集合が構成できる）。省略時は behavior から導出される。宣言は導出値より厳しい方向にのみ効く（緩める宣言は無視される）。ホストが「この環境では動かない配列」を隠す／警告するための情報であって、読み込みの可否には影響しない。"
    },
    "roles": {
      "type": "object",
      "additionalProperties": {
        "$ref": "#/$defs/roleDefinition"
      },
      "description": "役の宣言（v2）。正規名は機能ベース（holder1 / holder2 …）。leftThumb / rightThumb は別名として受理する"
    },
    "layouts": {
      "type": "object",
      "additionalProperties": {
        "type": "object",
        "additionalProperties": {
          "type": "array",
          "items": {
            "$ref": "#/$defs/keyName"
          }
        }
      },
      "description": "レイアウト固有の**追加**バインド（v2）。roles.keys に足す（上書きではない）"
    },
    "base": {
      "type": "string",
      "enum": [
        "characters",
        "positional"
      ],
      "description": "定義のベース（v2・逐次系のみ）。positional = 物理キー位置で照合する（かな配列）。既定は characters"
    },
    "name": {
      "type": "string",
      "minLength": 1,
      "description": "キーマップの表示名"
    },
    "description": {
      "type": "string",
      "description": "入力方式の説明"
    },
    "author": {
      "type": "string",
      "description": "配列の原作者名"
    },
    "contributor": {
      "oneOf": [
        {
          "type": "string"
        },
        {
          "type": "array",
          "items": {
            "type": "string"
          }
        }
      ],
      "description": "派生版の改変者。文字列または文字列の配列。"
    },
    "basedOn": {
      "type": "string",
      "description": "派生元の配列名（例: \"薙刀式\"）"
    },
    "license": {
      "type": "string",
      "description": "ライセンス識別子（SPDX 形式推奨）"
    },
    "addedAt": {
      "type": "string",
      "pattern": "^[0-9]{4}-[0-9]{2}-[0-9]{2}$",
      "description": "ハブサイトの「新着」に使う追加日（YYYY-MM-DD）。省略時は git の初回コミット日から推定するが、shallow clone のビルド環境では推定できないため、明示しておくのが確実"
    },
    "keyboardLayout": {
      "type": "string",
      "enum": [
        "us",
        "jis"
      ],
      "description": "対象キーボードの物理配列"
    },
    "targetScript": {
      "type": "string",
      "description": "出力文字体系（\"hiragana\", \"katakana\" 等）"
    },
    "behavior": {
      "$ref": "#/$defs/inputBehavior"
    },
    "controlBindings": {
      "$ref": "#/$defs/controlBindings"
    },
    "inputBase": {
      "type": "string",
      "enum": [
        "romaji"
      ],
      "description": "ベーステーブルの種類。\"romaji\" で組み込み標準ローマ字テーブルを自動ロード。"
    },
    "keyRemap": {
      "type": "object",
      "patternProperties": {
        "^_comment": {
          "type": "string"
        }
      },
      "additionalProperties": {
        "type": "string",
        "minLength": 1,
        "maxLength": 1
      },
      "propertyNames": {
        "anyOf": [
          {
            "type": "string",
            "minLength": 1,
            "maxLength": 1
          },
          {
            "type": "string",
            "pattern": "^_comment"
          }
        ]
      },
      "description": "キーリマップテーブル（物理キー文字 → 論理キー文字）。打鍵ごとにランタイムで適用され、バッファに入る前に論理キーへ変換される。inputBase / inputMappings / suffixRules はすべて論理キー空間のまま書く。\"_comment\" プレフィックスのキーは注記用として無視される。"
    },
    "suffixRules": {
      "type": "object",
      "additionalProperties": {
        "type": "object",
        "required": [
          "vowel",
          "suffix"
        ],
        "properties": {
          "vowel": {
            "type": "string",
            "enum": [
              "a",
              "i",
              "u",
              "e",
              "o"
            ]
          },
          "suffix": {
            "type": "string",
            "minLength": 1
          }
        },
        "additionalProperties": false
      },
      "description": "サフィックス展開ルール。キーは展開トリガー文字、値は { vowel, suffix } の展開定義。"
    },
    "inputMappings": {
      "type": "object",
      "additionalProperties": {
        "type": "string"
      },
      "description": "逐次入力のカスタムマッピング（キーシーケンス → かな）。inputBase / suffixRules と併用時は固有エントリのみ。"
    },
    "prefixShiftKeys": {
      "type": "array",
      "items": {
        "type": "string",
        "minLength": 1,
        "maxLength": 1
      },
      "description": "前置シフトキーの明示指定。指定されたキーのみシフトキーとして扱い ⇧ ラベル + シフトレイヤーを生成する。省略時は空配列と同等（前置シフトなし）。"
    },
    "modeKeys": {
      "type": "object",
      "additionalProperties": {
        "$ref": "#/$defs/keyActionValue"
      },
      "propertyNames": {
        "$ref": "#/$defs/modeKeyName"
      },
      "description": "モード切替キー（キー名 → アクション名）。修飾キープレフィックス（ctrl+, shift+, alt+）付きも可。逐次入力・同時打鍵問わず、英数直接入力モードの切替キーを定義する。"
    },
    "extensions": {
      "type": "object",
      "additionalProperties": {
        "type": "string"
      },
      "description": "アプリ固有の拡張フィールド。キー名は \"x-\" プレフィックスを推奨。"
    }
  },
  "additionalProperties": false,
  "$defs": {
    "inputBehavior": {
      "type": "object",
      "required": [
        "type"
      ],
      "oneOf": [
        {
          "properties": {
            "type": {
              "const": "sequential"
            },
            "characterMap": {
              "type": "object",
              "additionalProperties": {
                "type": "string",
                "minLength": 1,
                "maxLength": 1
              },
              "description": "半角→全角文字マッピング（1文字→1文字）"
            },
            "unusedPrefix": {
              "enum": [
                "emit",
                "drop"
              ],
              "description": "続きを得られなかった前置打鍵の扱い。emit（既定）= 素の文字で出す、drop = 捨てる。drop は requires に unusedPrefix:drop が要る"
            }
          },
          "required": [
            "type"
          ],
          "additionalProperties": false
        },
        {
          "properties": {
            "type": {
              "const": "chord"
            },
            "config": {
              "$ref": "#/$defs/chordConfig"
            }
          },
          "required": [
            "type",
            "config"
          ],
          "additionalProperties": false
        }
      ]
    },
    "chordConfig": {
      "type": "object",
      "required": [
        "hidToKey",
        "lookupTable",
        "specialActions"
      ],
      "allOf": [
        {
          "if": {
            "not": {
              "properties": {
                "judgment": {
                  "const": "mutual"
                }
              },
              "required": [
                "judgment"
              ]
            }
          },
          "then": {
            "required": [
              "simultaneousWindow"
            ]
          }
        }
      ],
      "properties": {
        "judgment": {
          "type": "string",
          "enum": [
            "window",
            "mutual"
          ],
          "description": "同時打鍵の判定方式。window=時間窓（simultaneousWindow 内の打鍵重なりのみを同時とみなす。省略時の既定）、mutual=相互シフト（薙刀式系。物理押下の重なりだけで判定し、時間を見ない）"
        },
        "hidToKey": {
          "type": "object",
          "additionalProperties": {
            "$ref": "#/$defs/chordKeyName"
          },
          "propertyNames": {
            "$ref": "#/$defs/keyName"
          },
          "description": "物理キー名 → ChordKey のマッピング"
        },
        "lookupTable": {
          "type": "object",
          "additionalProperties": {
            "type": "string"
          },
          "propertyNames": {
            "$ref": "#/$defs/bitmaskOrCommentName"
          },
          "description": "キー組合せビットマスク → 出力文字列。\"_comment\" プレフィックスのキーは注記用として無視される"
        },
        "specialActions": {
          "type": "object",
          "patternProperties": {
            "^_comment": {
              "type": "string"
            }
          },
          "additionalProperties": {
            "$ref": "#/$defs/keyActionValue"
          },
          "propertyNames": {
            "$ref": "#/$defs/bitmaskOrCommentName"
          },
          "description": "キー組合せビットマスク → 特殊アクション"
        },
        "simultaneousWindow": {
          "type": "number",
          "exclusiveMinimum": 0,
          "description": "同時打鍵判定ウィンドウ（秒）。judgment=window では必須。judgment=mutual では判定に使用されない（旧実装との互換のため記載してもよい）"
        },
        "englishLookupTable": {
          "type": "object",
          "additionalProperties": {
            "type": "string"
          },
          "propertyNames": {
            "$ref": "#/$defs/bitmaskOrCommentName"
          },
          "description": "英数モード用の lookup テーブル"
        },
        "englishSpecialActions": {
          "type": "object",
          "patternProperties": {
            "^_comment": {
              "type": "string"
            }
          },
          "additionalProperties": {
            "$ref": "#/$defs/keyActionValue"
          },
          "propertyNames": {
            "$ref": "#/$defs/bitmaskOrCommentName"
          },
          "description": "英数モード用の特殊アクション"
        },
        "shiftKeys": {
          "type": "array",
          "items": {
            "$ref": "#/$defs/shiftKeyConfig"
          },
          "minItems": 0,
          "maxItems": 2,
          "description": "**v2 で廃止**（roles へ移動）。残っていても読まれる実装があるため型だけ保持する"
        }
      },
      "additionalProperties": false
    },
    "shiftKeyConfig": {
      "type": "object",
      "required": [
        "key"
      ],
      "properties": {
        "key": {
          "$ref": "#/$defs/chordKeyName"
        },
        "singleTapAction": {
          "$ref": "#/$defs/keyActionValue"
        }
      },
      "additionalProperties": false
    },
    "controlBindings": {
      "type": "object",
      "properties": {
        "emacsBindings": {
          "type": "object",
          "additionalProperties": {
            "$ref": "#/$defs/keyActionValue"
          },
          "propertyNames": {
            "$ref": "#/$defs/keyName"
          },
          "description": "Ctrl+キー → KeyAction のマッピング"
        },
        "ctrlSemicolonAction": {
          "$ref": "#/$defs/keyActionValue",
          "description": "Ctrl+; のアクション"
        },
        "ctrlColonAction": {
          "$ref": "#/$defs/keyActionValue",
          "description": "Ctrl+: のアクション"
        }
      },
      "additionalProperties": false
    },
    "chordKeyName": {
      "type": "string",
      "enum": [
        "Q",
        "W",
        "E",
        "R",
        "T",
        "Y",
        "U",
        "I",
        "O",
        "P",
        "A",
        "S",
        "D",
        "F",
        "G",
        "H",
        "J",
        "K",
        "L",
        "semicolon",
        "Z",
        "X",
        "C",
        "V",
        "B",
        "N",
        "M",
        "comma",
        "dot",
        "slash",
        "space",
        "leftThumb",
        "rightThumb"
      ],
      "description": "ChordKey 識別子（QWERTY 30キー + 親指3キー）"
    },
    "keyName": {
      "type": "string",
      "enum": [
        "a",
        "b",
        "c",
        "d",
        "e",
        "f",
        "g",
        "h",
        "i",
        "j",
        "k",
        "l",
        "m",
        "n",
        "o",
        "p",
        "q",
        "r",
        "s",
        "t",
        "u",
        "v",
        "w",
        "x",
        "y",
        "z",
        "1",
        "2",
        "3",
        "4",
        "5",
        "6",
        "7",
        "8",
        "9",
        "0",
        "enter",
        "escape",
        "backspace",
        "delete",
        "tab",
        "space",
        "capsLock",
        "hyphen",
        "equal",
        "bracketLeft",
        "bracketRight",
        "backslash",
        "semicolon",
        "quote",
        "backquote",
        "comma",
        "period",
        "slash",
        "arrowRight",
        "arrowLeft",
        "arrowDown",
        "arrowUp",
        "home",
        "end",
        "pageUp",
        "pageDown",
        "f1",
        "f2",
        "f3",
        "f4",
        "f5",
        "f6",
        "f7",
        "f8",
        "f9",
        "f10",
        "f11",
        "f12",
        "international1",
        "international2",
        "international3",
        "international4",
        "international5",
        "lang1",
        "lang2",
        "rightAlt"
      ],
      "description": "物理キー名（フォーマット独自命名、USB HID Keyboard/Keypad Page に対応）"
    },
    "modeKeyName": {
      "type": "string",
      "pattern": "^((ctrl|shift|alt)\\+)*(a|b|c|d|e|f|g|h|i|j|k|l|m|n|o|p|q|r|s|t|u|v|w|x|y|z|[0-9]|enter|escape|backspace|delete|tab|space|capsLock|hyphen|equal|bracketLeft|bracketRight|backslash|semicolon|quote|backquote|comma|period|slash|arrowRight|arrowLeft|arrowDown|arrowUp|home|end|pageUp|pageDown|f[0-9]+|international[1-5]|lang[12]|rightAlt)$",
      "description": "モード切替キー名。修飾キープレフィックス（ctrl+, shift+, alt+）付き可。例: \"lang1\", \"ctrl+space\", \"ctrl+shift+j\""
    },
    "bitmaskString": {
      "type": "string",
      "pattern": "^[A-Za-z][A-Za-z0-9]*(\\+[A-Za-z][A-Za-z0-9]*)*$",
      "description": "ChordKey / 役の組合せ表記（\"+\" 区切り）。役は holder1 のように数字を含みうる"
    },
    "bitmaskOrCommentName": {
      "anyOf": [
        {
          "$ref": "#/$defs/bitmaskString"
        },
        {
          "type": "string",
          "pattern": "^_comment"
        }
      ],
      "description": "ビットマスク表記、または \"_comment\" プレフィックスの注記キー"
    },
    "keyActionString": {
      "type": "string",
      "description": "アクション文字列。well-known 名またはパラメータ付き形式。\"x-\" プレフィックスでアプリ固有アクションを拡張可能。語彙の正典は docs/key-action-registry.json（面ごとの可否・実装対応はそちらを参照。CI: scripts/check_action_registry.py）。",
      "anyOf": [
        {
          "enum": [
            "convert",
            "convertPrev",
            "confirm",
            "cancel",
            "deleteBack",
            "moveLeft",
            "moveRight",
            "moveUp",
            "moveDown",
            "editSegmentLeft",
            "editSegmentRight",
            "confirmHiragana",
            "confirmKatakana",
            "confirmHalfWidthKatakana",
            "confirmFullWidthRoman",
            "confirmHalfWidthRoman",
            "switchToEnglish",
            "switchToJapanese",
            "toggleInputMode",
            "insertSpace",
            "postModify",
            "pass"
          ]
        },
        {
          "pattern": "^insertSpace:shifted$"
        },
        {
          "pattern": "^postModify:(cycle|cycleDakuten|dakuten|handakuten|small)$"
        },
        {
          "pattern": "^selectCandidate:[0-9]+$"
        },
        {
          "pattern": "^insertAndConfirm:.+$"
        },
        {
          "pattern": "^directInsert:.+$"
        },
        {
          "pattern": "^x-.+$"
        }
      ]
    },
    "keymapPhase": {
      "type": "string",
      "enum": [
        "idle",
        "composing",
        "selecting"
      ],
      "description": "入力の局面。idle=何も合成していない / composing=よみ入力中 / selecting=変換中・候補選択中"
    },
    "keyActionValue": {
      "description": "アクション。文字列、または局面ガード付きのオブジェクト。ガードが外れたエントリは「定義が無い」ものとして扱われ、ルーティングは次の優先順位へ落ちる。",
      "anyOf": [
        {
          "$ref": "#/$defs/keyActionString"
        },
        {
          "type": "object",
          "required": [
            "action"
          ],
          "additionalProperties": false,
          "properties": {
            "action": {
              "$ref": "#/$defs/keyActionString"
            },
            "when": {
              "type": "array",
              "items": {
                "$ref": "#/$defs/keymapPhase"
              },
              "minItems": 1,
              "uniqueItems": true,
              "description": "このアクションが有効な局面。省略時は全局面。"
            }
          }
        }
      ]
    },
    "roleDefinition": {
      "type": "object",
      "additionalProperties": false,
      "properties": {
        "label": {
          "type": "string",
          "description": "表示名（可読性のためだけ。ランタイムは使わない）"
        },
        "keys": {
          "type": "array",
          "items": {
            "$ref": "#/$defs/keyName"
          },
          "uniqueItems": true,
          "description": "既定の物理キー**候補**。単一キーではなく配列（NICOLA は 1 役に 2 キーを割り当てている）。届かないキーは無視される"
        },
        "singleTapAction": {
          "$ref": "#/$defs/keyActionValue",
          "description": "単打時のフォールバック。省略時はランタイムの既定"
        }
      }
    }
  }
}
