{
  "$schema": "../../../docs/keymap-v2.schema.json",
  "formatVersion": "2.0",
  "name": "NICOLA",
  "description": "NICOLA 親指シフト入力",
  "author": "日本語入力コンソーシアム",
  "targetScript": "hiragana",
  "roles": {
    "holder1": {
      "label": "左親指 / センターシフト",
      "keys": [
        "lang2",
        "international5"
      ]
    },
    "holder2": {
      "label": "右親指",
      "keys": [
        "lang1",
        "international4"
      ]
    }
  },
  "layouts": {
    "us": {
      "holder1": [
        "space"
      ],
      "holder2": [
        "rightAlt"
      ]
    }
  },
  "behavior": {
    "type": "chord",
    "config": {
      "hidToKey": {
        "q": "Q",
        "w": "W",
        "e": "E",
        "r": "R",
        "t": "T",
        "y": "Y",
        "u": "U",
        "i": "I",
        "o": "O",
        "p": "P",
        "a": "A",
        "s": "S",
        "d": "D",
        "f": "F",
        "g": "G",
        "h": "H",
        "j": "J",
        "k": "K",
        "l": "L",
        "semicolon": "semicolon",
        "z": "Z",
        "x": "X",
        "c": "C",
        "v": "V",
        "b": "B",
        "n": "N",
        "m": "M",
        "comma": "comma",
        "period": "dot",
        "slash": "slash"
      },
      "lookupTable": {
        "Q": "。",
        "W": "か",
        "E": "た",
        "R": "こ",
        "T": "さ",
        "Y": "ら",
        "U": "ち",
        "I": "く",
        "O": "つ",
        "P": "、",
        "semicolon": "ん",
        "A": "う",
        "S": "し",
        "D": "て",
        "F": "け",
        "G": "せ",
        "H": "は",
        "J": "と",
        "K": "き",
        "L": "い",
        "Z": "．",
        "X": "ひ",
        "C": "す",
        "V": "ふ",
        "B": "へ",
        "N": "め",
        "M": "そ",
        "comma": "ね",
        "dot": "ほ",
        "slash": "・",
        "holder1+Q": "ぁ",
        "holder1+W": "え",
        "holder1+E": "り",
        "holder1+R": "ゃ",
        "holder1+T": "れ",
        "holder1+Y": "ぱ",
        "holder1+U": "ぢ",
        "holder1+I": "ぐ",
        "holder1+O": "づ",
        "holder1+P": "ぴ",
        "holder1+semicolon": "ー",
        "holder1+A": "を",
        "holder1+S": "あ",
        "holder1+D": "な",
        "holder1+F": "ゅ",
        "holder1+G": "も",
        "holder1+H": "ば",
        "holder1+J": "ど",
        "holder1+K": "ぎ",
        "holder1+L": "ぽ",
        "holder1+Z": "ぅ",
        "holder1+X": "ー",
        "holder1+C": "ろ",
        "holder1+V": "や",
        "holder1+B": "ぃ",
        "holder1+N": "ぷ",
        "holder1+M": "ぞ",
        "holder1+comma": "ぺ",
        "holder1+dot": "ぼ",
        "holder1+slash": "ぉ",
        "holder2+Q": "ぁ",
        "holder2+W": "が",
        "holder2+E": "だ",
        "holder2+R": "ご",
        "holder2+T": "ざ",
        "holder2+Y": "よ",
        "holder2+U": "に",
        "holder2+I": "る",
        "holder2+O": "ま",
        "holder2+P": "ぇ",
        "holder2+semicolon": "っ",
        "holder2+A": "ゔ",
        "holder2+S": "じ",
        "holder2+D": "で",
        "holder2+F": "げ",
        "holder2+G": "ぜ",
        "holder2+H": "み",
        "holder2+J": "お",
        "holder2+K": "の",
        "holder2+L": "ょ",
        "holder2+Z": "ぅ",
        "holder2+X": "び",
        "holder2+C": "ず",
        "holder2+V": "ぶ",
        "holder2+B": "べ",
        "holder2+N": "ぬ",
        "holder2+M": "ゆ",
        "holder2+comma": "む",
        "holder2+dot": "わ",
        "holder2+slash": "ぉ"
      },
      "specialActions": {},
      "judgment": "window",
      "simultaneousWindow": 0.1
    }
  },
  "requires": [
    "roles"
  ],
  "modeKeys": {
    "ctrl+space": "toggleInputMode",
    "ctrl+shift+j": "switchToJapanese",
    "ctrl+shift+semicolon": "switchToEnglish"
  }
}
