{
  "$schema": "../../../docs/keymap-v2.schema.json",
  "formatVersion": "2.0",
  "name": "ローマ字(Colemak JIS)",
  "description": "Colemak 配列でのローマ字入力。iPadOS が Colemak をサポートしないため、アプリ側で QWERTY→Colemak キーリマップを行う。",
  "author": "Shai Coleman",
  "license": "Unlicense",
  "targetScript": "hiragana",
  "inputMappings": {
    "_comment_punctuation": "句読点・記号",
    ",": "、",
    ".": "。",
    "/": "・",
    "-": "ー",
    "[": "「",
    "]": "」"
  },
  "inputBase": "romaji",
  "keyRemap": {
    "_comment_top": "上段: QWERTY→Colemak",
    "e": "f",
    "r": "p",
    "t": "g",
    "y": "j",
    "u": "l",
    "i": "u",
    "o": "y",
    "p": ";",
    "_comment_middle": "中段: QWERTY→Colemak",
    "s": "r",
    "d": "s",
    "f": "t",
    "g": "d",
    "j": "n",
    "k": "e",
    "l": "i",
    ";": "o",
    "_comment_bottom": "下段: QWERTY→Colemak",
    "n": "k"
  },
  "prefixShiftKeys": [],
  "behavior": {
    "type": "sequential",
    "characterMap": {
      "0": "０",
      "1": "１",
      "2": "２",
      "3": "３",
      "4": "４",
      "5": "５",
      "6": "６",
      "7": "７",
      "8": "８",
      "9": "９",
      ";": "；",
      "{": "『",
      "}": "』",
      "(": "（",
      ")": "）",
      "<": "＜",
      ">": "＞",
      "^": "＾",
      "_": "＿",
      "\"": "”",
      "'": "’",
      "`": "｀",
      "+": "＋",
      "=": "＝",
      "*": "＊",
      "!": "！",
      "?": "？",
      "@": "＠",
      "#": "＃",
      "$": "＄",
      "%": "％",
      "&": "＆",
      "|": "｜",
      "\\": "＼",
      "~": "〜",
      "¥": "￥"
    }
  },
  "modeKeys": {
    "ctrl+space": "toggleInputMode",
    "ctrl+shift+j": "switchToJapanese",
    "ctrl+shift+semicolon": "switchToEnglish",
    "lang2": "switchToEnglish",
    "lang1": "switchToJapanese"
  }
}
